{
  "id": "business-building-skills",
  "repository": "https://github.com/sb-dev/business-building-skills",
  "domain": "business-building",
  "status": "proposed",
  "capabilities": [
    "opportunity-framing",
    "customer-problem-model",
    "value-proposition",
    "offer-design",
    "pricing",
    "monetisation",
    "lead-generation",
    "channel-strategy",
    "sales-conversion",
    "delivery-economics",
    "retention-expansion",
    "unit-economics",
    "cash-risk",
    "business-experimentation",
    "constraint-diagnosis"
  ],
  "pactwright": "planned"
}
