{
  "id": "character-production-skills",
  "repository": "https://github.com/sb-dev/character-production-skills",
  "domain": "character-production",
  "status": "proposed",
  "capabilities": [
    "character-design",
    "npc-production",
    "character-lod",
    "game-readiness"
  ],
  "pactwright": "planned"
}
